"ID","URL","Title","Difficulty","Acceptance %","Frequency %","Topic Tags","Pattern","Revision Priority","Notes"
"196","https://leetcode.com/problems/delete-duplicate-emails","Delete Duplicate Emails","Easy","66.0%","62.5%","Arrays","Sorting / Prefix / Scan","Medium","Practice after high-priority questions; useful interview pattern."
"3","https://leetcode.com/problems/longest-substring-without-repeating-characters","Longest Substring Without Repeating Characters","Medium","39.1%","62.5%","Strings; Trees","Hashing / Sliding Window; DFS / BFS; Sliding Window","Medium","Practice after high-priority questions; useful interview pattern."
"1","https://leetcode.com/problems/two-sum","Two Sum","Easy","57.5%","75.0%","Arrays","Sorting / Prefix / Scan; Two Pointers","High","Must revise; common company/OA pattern."
"49","https://leetcode.com/problems/group-anagrams","Group Anagrams","Medium","72.6%","75.0%","Strings","Hashing / Sliding Window","High","Must revise; common company/OA pattern."
"185","https://leetcode.com/problems/department-top-three-salaries","Department Top Three Salaries","Hard","60.5%","62.5%","Core DSA","Implementation / Reasoning","Medium","Practice after high-priority questions; useful interview pattern."
"696","https://leetcode.com/problems/count-binary-substrings","Count Binary Substrings","Easy","70.4%","100.0%","Strings; Trees","Hashing / Sliding Window; DFS / BFS","High","Must revise; common company/OA pattern."
"1328","https://leetcode.com/problems/break-a-palindrome","Break a Palindrome","Medium","51.6%","75.0%","Strings","Hashing / Sliding Window","High","Must revise; common company/OA pattern."
"1413","https://leetcode.com/problems/minimum-value-to-get-positive-step-by-step-sum","Minimum Value to Get Positive Step by Step Sum","Easy","64.7%","75.0%","Arrays","Sorting / Prefix / Scan","High","Must revise; common company/OA pattern."
