"ID","URL","Title","Difficulty","Acceptance %","Frequency %","Topic Tags","Pattern","Revision Priority","Notes"
"121","https://leetcode.com/problems/best-time-to-buy-and-sell-stock","Best Time to Buy and Sell Stock","Easy","56.8%","100.0%","Core DSA","Implementation / Reasoning","High","Must revise; common company/OA pattern."
"1419","https://leetcode.com/problems/minimum-number-of-frogs-croaking","Minimum Number of Frogs Croaking","Medium","51.1%","62.5%","Arrays","Sorting / Prefix / Scan","Medium","Practice after high-priority questions; useful interview pattern."
"227","https://leetcode.com/problems/basic-calculator-ii","Basic Calculator II","Medium","46.9%","75.0%","Stack / Queue","Monotonic Stack / Simulation","High","Must revise; common company/OA pattern."
"994","https://leetcode.com/problems/rotting-oranges","Rotting Oranges","Medium","58.7%","62.5%","Core DSA","Implementation / Reasoning","Medium","Practice after high-priority questions; useful interview pattern."
"443","https://leetcode.com/problems/string-compression","String Compression","Medium","60.0%","62.5%","Strings","Hashing / Sliding Window","Medium","Practice after high-priority questions; useful interview pattern."
"149","https://leetcode.com/problems/max-points-on-a-line","Max Points on a Line","Hard","30.7%","62.5%","Core DSA","Implementation / Reasoning","Medium","Practice after high-priority questions; useful interview pattern."
