"ID","URL","Title","Difficulty","Acceptance %","Frequency %","Topic Tags","Pattern","Revision Priority","Notes"
"1992","https://leetcode.com/problems/find-all-groups-of-farmland","Find All Groups of Farmland","Medium","75.5%","100.0%","Core DSA","Implementation / Reasoning","High","Must revise; common company/OA pattern."
"2840","https://leetcode.com/problems/check-if-strings-can-be-made-equal-with-operations-ii","Check if Strings Can be Made Equal With Operations II","Medium","74.0%","100.0%","Strings","Hashing / Sliding Window","High","Must revise; common company/OA pattern."
"2839","https://leetcode.com/problems/check-if-strings-can-be-made-equal-with-operations-i","Check if Strings Can be Made Equal With Operations I","Easy","61.9%","100.0%","Strings","Hashing / Sliding Window","High","Must revise; common company/OA pattern."
"1383","https://leetcode.com/problems/maximum-performance-of-a-team","Maximum Performance of a Team","Hard","47.8%","100.0%","Arrays","Sorting / Prefix / Scan","High","Must revise; common company/OA pattern."
"146","https://leetcode.com/problems/lru-cache","LRU Cache","Medium","47.4%","62.5%","Design","Data Structure Design","Medium","Practice after high-priority questions; useful interview pattern."
