"ID","URL","Title","Difficulty","Acceptance %","Frequency %","Topic Tags","Pattern","Revision Priority","Notes"
"2082","https://leetcode.com/problems/the-number-of-rich-customers","The Number of Rich Customers","Easy","77.3%","100.0%","Core DSA","Implementation / Reasoning","High","Must revise; common company/OA pattern."
"49","https://leetcode.com/problems/group-anagrams","Group Anagrams","Medium","72.6%","87.5%","Strings","Hashing / Sliding Window","High","Must revise; common company/OA pattern."
"3","https://leetcode.com/problems/longest-substring-without-repeating-characters","Longest Substring Without Repeating Characters","Medium","39.1%","75.0%","Strings; Trees","Hashing / Sliding Window; DFS / BFS; Sliding Window","High","Must revise; common company/OA pattern."
"56","https://leetcode.com/problems/merge-intervals","Merge Intervals","Medium","51.8%","75.0%","Arrays","Sorting / Prefix / Scan","High","Must revise; common company/OA pattern."
"5","https://leetcode.com/problems/longest-palindromic-substring","Longest Palindromic Substring","Medium","37.8%","62.5%","Strings; Trees","Hashing / Sliding Window; DFS / BFS","Medium","Practice after high-priority questions; useful interview pattern."
