"ID","URL","Title","Difficulty","Acceptance %","Frequency %","Topic Tags","Pattern","Revision Priority","Notes"
"735","https://leetcode.com/problems/asteroid-collision","Asteroid Collision","Medium","47.9%","75.0%","Core DSA","Implementation / Reasoning","High","Must revise; common company/OA pattern."
"1292","https://leetcode.com/problems/maximum-side-length-of-a-square-with-sum-less-than-or-equal-to-threshold","Maximum Side Length of a Square with Sum Less than or Equal to Threshold","Medium","65.4%","100.0%","Arrays","Sorting / Prefix / Scan","High","Must revise; common company/OA pattern."
"1293","https://leetcode.com/problems/shortest-path-in-a-grid-with-obstacles-elimination","Shortest Path in a Grid with Obstacles Elimination","Hard","46.3%","75.0%","Trees","DFS / BFS","High","Must revise; common company/OA pattern."
"155","https://leetcode.com/problems/min-stack","Min Stack","Medium","58.2%","75.0%","Stack / Queue","Monotonic Stack / Simulation","High","Must revise; common company/OA pattern."
"1889","https://leetcode.com/problems/minimum-space-wasted-from-packaging","Minimum Space Wasted From Packaging","Hard","33.6%","100.0%","Arrays","Sorting / Prefix / Scan","High","Must revise; common company/OA pattern."
