"ID","URL","Title","Difficulty","Acceptance %","Frequency %","Topic Tags","Pattern","Revision Priority","Notes"
"146","https://leetcode.com/problems/lru-cache","LRU Cache","Medium","47.4%","87.5%","Design","Data Structure Design","High","Must revise; common company/OA pattern."
"88","https://leetcode.com/problems/merge-sorted-array","Merge Sorted Array","Easy","54.9%","100.0%","Arrays","Sorting / Prefix / Scan","High","Must revise; common company/OA pattern."
"21","https://leetcode.com/problems/merge-two-sorted-lists","Merge Two Sorted Lists","Easy","68.3%","62.5%","Arrays; Linked List","Sorting / Prefix / Scan; Two Pointers","Medium","Practice after high-priority questions; useful interview pattern."
"1893","https://leetcode.com/problems/check-if-all-the-integers-in-a-range-are-covered","Check if All the Integers in a Range Are Covered","Easy","51.1%","87.5%","Core DSA","Implementation / Reasoning","High","Must revise; common company/OA pattern."
"56","https://leetcode.com/problems/merge-intervals","Merge Intervals","Medium","51.8%","50.0%","Arrays","Sorting / Prefix / Scan","Medium","Practice after high-priority questions; useful interview pattern."
